voKAa8,pM8Krb,2025-02-20 20:11:54,Nishant Pandita,nishant.pandita.we@gmail.com,1993-02-14,No,"Mantri Flora, Tower B- 1103, Sarjapur Road, HSR layout, Near Manipal Hospital, Bangalore",560102,https://storage.tally.so/private/unnamed-7-.jpg?id=xpN0ey&accessToken=eyJhbGciOiJIUzI1NiIsInR5cCI6IkpXVCJ9.eyJpZCI6InhwTjBleSIsImZvcm1JZCI6IndkS2xXQSIsImlhdCI6MTc0MDA4MjMxNn0.1jbpaK8KMzTQkN0npqY432jvA6wTWsiqnBRHA6dNMYY&signature=2976d9e64d3de9114c8f567b63cdfd092525dc98cc09891a857b447f35708bad,No,,,Gokiwi,Product Lead,3-8,"🚀 FinTech Product Lead | Driving Innovation in Credit & Payments

I am a results-oriented Product Manager with 8+ years of experience in designing, launching, and scaling innovative FinTech products. My expertise lies in building consumer-facing credit, payments, and lending solutions that drive user growth, engagement, and retention.

📌 Key Highlights:

Currently shaping India’s first credit-on-UPI app as the Founding Product Manager at Gokiwi, where I scaled card issuance to 150K users in just 6 months with a 95% activation rate.
Successfully led the Buy Now Pay Later (BNPL) initiative at Freecharge, scaling it to 500K users in 12 months, while achieving an industry-leading 96.5% repayment rate.
Pioneered Revenue-Based Financing at Indifi, scaling it to Rs. 50 crore book size with a 0.9% delinquency rate.

💡 What I Do Best:

Solving complex problems at the intersection of finance and technology.
Driving user-centric product strategies that deliver measurable results.
Partnering with cross-functional teams to create seamless customer experiences.

🌟 Passionate About:
I’m deeply invested in financial inclusion, leveraging cutting-edge technology to simplify credit and payments for users. Outside work, I’m intrigued by poker, a game that sharpens my strategic thinking, and I believe it mirrors the critical decision-making involved in product leadership.",,"I am very new to the AI world. Want to understand the underlying base technology in depth so that i can utilise the same to build as well as improve my efficiency.

I believe if i can get a solid hang of the base tech in this cohort using tools and implementing those will be much easier.",I've never coded,,,,,No,,No,,https://storage.tally.so/private/Nishant_Pandita_Resume.pdf?id=b742Bo&accessToken=eyJhbGciOiJIUzI1NiIsInR5cCI6IkpXVCJ9.eyJpZCI6ImI3NDJCbyIsImZvcm1JZCI6IndkS2xXQSIsImlhdCI6MTc0MDA4MjMxNn0.-ev9QjsIvPmvytcvM-CkYDrhphx4xUMVv23AV4T5K8c&signature=5e44b55a414f83a05a7958651b4c812b8dea54935e6548e32f65f031340f1359,,https://www.linkedin.com/in/nishant-pandita-1165ba35/,,,No-Code,,Finance and Banking,,Retail Banking,,Others,Financial Services,More efficient usage of payment methods to drive better value for customer. Example: You have 10 Credit cards: Which card should you use when and for which txn?,"Playing Poker, Solving a puzzle, Doing art and craft, reading and learning about stock markets",,,,,https://docs.google.com/spreadsheets/d/1krkTYB0tWkQSyKo3b5grF8EShcXd_y4Og8qmpRab894/edit?usp=sharing,,https://storage.tally.so/private/The-Ikigai-Template-_-Recalibrate-How-You-Spend-Your-Time.pptx?id=AdbAPD&accessToken=eyJhbGciOiJIUzI1NiIsInR5cCI6IkpXVCJ9.eyJpZCI6IkFkYkFQRCIsImZvcm1JZCI6IndkS2xXQSIsImlhdCI6MTc0MDA4MjMxNn0.xVbNEbuUHB7iNo9qL8qMN5QBatumgGfuyqKxbMaB5m8&signature=b238dd6e1c6b5294f51fc30e6e0d8668f673779e5b2f380eaef23c6e635612b9
2Q7pdD,KgdkeA,2025-02-21 01:04:36,Krushil Patel,Krushilp1@gmail.com,1998-04-30,Yes,"40, Tuxedo Court
Apt#805
M1G 3S7
Scarborough, Ontario, Canada",M1G 3S7,https://storage.tally.so/private/IMG_5114.JPEG?id=Gzd04j&accessToken=eyJhbGciOiJIUzI1NiIsInR5cCI6IkpXVCJ9.eyJpZCI6Ikd6ZDA0aiIsImZvcm1JZCI6IndkS2xXQSIsImlhdCI6MTc0MDA5OTg3OX0.wWCu8-ZhS0RW5vlYcXB3dlMKNsMdM10MkKdiiDuBVIc&signature=a5600fa32b7ab188c8e7e5e3486c8c80ad90468aca83759636c45b32aea899c7,No,,,N/A,N/A,<1,"I moved to Canada after completing my 12th grade in Ahmedabad. I got enrolled in Business Accounting Diploma course in Canadian College. 

After completing my course, I started working as a Restaurant manager at Pizzahut. I worked there for three years and Meanwhile I studies Project management and Business analysis.

I tried to look for opportunities in Business analysis, but couldn't land a job as the job market in Canada got worse after covid.

Currently I am working as a Security operation assistant. 

I have 0 experience in IT.",,I am looking forward to start my own AI agency. I am also learning python.,I've never coded,,,,,No,,No,,https://storage.tally.so/private/Krushil-Patel-Resume.docx?id=0x6LQj&accessToken=eyJhbGciOiJIUzI1NiIsInR5cCI6IkpXVCJ9.eyJpZCI6IjB4NkxRaiIsImZvcm1JZCI6IndkS2xXQSIsImlhdCI6MTc0MDA5OTg3OX0.EMCslBhj6mPBlzplPxgbIuWTT_xEUrjbrCm2cGp5EWQ&signature=f27a7dd04de06d6fa083aa651829ef0c1eced52e5a89a50f4a02f2611e030566,N/A,Entrepreneur Track (I want to build products),No,,No-Code,,,,,,Customer Support Automation,,"As I was a Restaurant manager, I realised that many customers prefer to place order online but very often they call in-store to know the timings or the availibilty of Item. Which require owners to put extra staff just to pick up call.

I want to build a robust customer support agent for restaurant which can have human like conversation to customers and can solve their queries.",,Cannot think of anything yet.,Customer Service or sales agent for Ecommerce businesses,,N/A,,https://docs.google.com/spreadsheets/d/1aGbChixh9XskYVsi4Yp4feM9xfqoMHKfv0jNyyEnNio/edit?usp=sharing,https://storage.tally.so/private/Krushil-PatelThe-Ikigai-Template-_-Recalibrate-How-You-Spend-Your-Time.pptx?id=OzBroA&accessToken=eyJhbGciOiJIUzI1NiIsInR5cCI6IkpXVCJ9.eyJpZCI6Ik96QnJvQSIsImZvcm1JZCI6IndkS2xXQSIsImlhdCI6MTc0MDA5OTg3OX0.LDBvhV87pEhZi4oKv7ZsMK3WL_iv1Tv5NuB6z3VQnUo&signature=858d2cbbe6148cc9ff72d2a25a7cee88c8f144400450defce2d9146cafc05829
j1zpzY,NgeD1W,2025-02-21 07:24:23,Yash Bansal,0002.yash@gmail.com,2000-11-03,No,"193/27/3, Midland Colony, Masani Road, Mathura",281001,https://storage.tally.so/private/Indian-ASI.jpg?id=qdElB5&accessToken=eyJhbGciOiJIUzI1NiIsInR5cCI6IkpXVCJ9.eyJpZCI6InFkRWxCNSIsImZvcm1JZCI6IndkS2xXQSIsImlhdCI6MTc0MDEyMjY2Nn0.urnIPNyUURQBGZamfSmESWNkBPyCH9ZpsRX4_b6JIvQ&signature=e81d69f2a6b5cf410563561170429cbcae0c8b3d53ab886470f35bc845edb371,Yes,Yes,B.Com (Hons),,Associate - Knowledge Management,1-3,I have worked in Bain & Co's Knowledge Management for 2 years. ,,"To know the technical of building AI products like web app, software, virtual avtar, AI Agents, workflows etc. ",I've never coded,,,,,No,,No,,https://storage.tally.so/private/MDI_24P247_Yash-Bansal_CV.pdf?id=XDBbBL&accessToken=eyJhbGciOiJIUzI1NiIsInR5cCI6IkpXVCJ9.eyJpZCI6IlhEQmJCTCIsImZvcm1JZCI6IndkS2xXQSIsImlhdCI6MTc0MDEyMjY2Nn0.8LBPXaQjRXkLATrQBUwv_21eKx8XYbNl9EzqOI9_FWg&signature=126a491440033854db661733a16afdacecc92740a7b10e61a7f984391e92da42,https://www.linkedin.com/in/yash-bansal-290553191/,Entrepreneur Track (I want to build products),No,,No-Code,,,,,,Pharmaceutical Research,,I want to use the applications of Generative AI in the field of healthcare for drug discovery and advancements in medicine. ,,"I want to solve the problem of in 3 areas:
1. Healthcare: schizophrenia, diffused axonal injury and kidney failure. 
2. Mobility: Urban Air Mobility and Autonomous vehicles
3. Circularity: Building Supply chain for environmental sustainability","I have tried to build a new kind of networking platform. 
Right now I am researching the impact of AI on education, employment and economy and make a framework of how post-labor economy would work with UBI, tokenization etc. 

And how Joule would be the future of currency, attention as the only economic scarcity and human agency as the only wealth. ",,I have made an NGO for making Mathura the cleanest city in the country. I have made a reverse supply chain for collecting MLP waste and get it into the circularity for recycling. The main challenge was supply chain which I am still figuring out to solve. ,,https://docs.google.com/spreadsheets/d/1xUg_a_qKHPH9xcfAZSgE6gamwkEHP7Zltg0ezN_cW_0/edit?usp=sharing,https://storage.tally.so/private/Yash-Bansal-The-Ikigai-Template-_-Recalibrate-How-You-Spend-Your-Time.pdf?id=J6k4aK&accessToken=eyJhbGciOiJIUzI1NiIsInR5cCI6IkpXVCJ9.eyJpZCI6Iko2azRhSyIsImZvcm1JZCI6IndkS2xXQSIsImlhdCI6MTc0MDEyMjY2Nn0.s3MV0FBtUAeL8TFp8lomOvjlibEKvdC3OiTtMQdxQHg&signature=037ef4e3f3788c53ebddeb785f5eb384ecd1167843a3dc950b469f4741a576af
YN9NAv,op4oeb,2025-02-21 09:37:45,Suraj Kakkad,surajkakkad98@gmail.com,1998-05-21,No,"105, Madhav Residency, st-1, Kidavai nagar, 150ft ring rd, rajkot, gujarat",360005,https://storage.tally.so/private/IMG_4884.JPG?id=YQdMZv&accessToken=eyJhbGciOiJIUzI1NiIsInR5cCI6IkpXVCJ9.eyJpZCI6IllRZE1adiIsImZvcm1JZCI6IndkS2xXQSIsImlhdCI6MTc0MDEzMDY2N30.d3bvL6VQJyxxMuZ3P4oLk_wCXdVqnFKURZ9dzONI3-E&signature=72a83e3ec5d3d57cca020302cf6c5ef9a027f86379e8daad06dd2691166dc63e,No,,,Panafrique Motors Sarl,Business Development Executive,1-3,"I've founded and worked in india trading, sorting and packaging agri commodities, I still do however its more part time now. Later joined as an importation and clearance executive for a vehicle dealership in DR Congo. Currently with the same company working as a business development executive. The company mainly focuses on trading trucks and buses from imports from India and China.",,"Get network, Get skills, Get confidence",I'm familiar with coding,No,I'm well versed in Python,,1-3,No,,No,,https://storage.tally.so/private/White-and-Black-Modern-New-Graduate-Professional-Resume.pdf?id=V0Vv2a&accessToken=eyJhbGciOiJIUzI1NiIsInR5cCI6IkpXVCJ9.eyJpZCI6IlYwVnYyYSIsImZvcm1JZCI6IndkS2xXQSIsImlhdCI6MTc0MDEzMDY2N30.9xfbXlpMs2IfMCfrbMG0ZZAPOsMaMRTnKGZbSbTJHqo&signature=b8e4872b3d93c21f5313dbf4d744fabbf3df45ff4d2bfca1fd87638f2198946e,https://in.linkedin.com/in/suraj-kakkad-629649a1?trk=people-guest_people_search-card,Entrepreneur Track (I want to build products),Yes,"Mainly dealing with trading physical and tangible goods. (commodities, vehicle)",No-Code,,,,,,Retail Inventory Management,,I'd like to make something to help manage spare part off-take and on-take. Keeping inventory under control given the seasonal sales for certain category of spare parts and the aging of the vehicle population sold over the years.,,"Healthcare, Fact Checks, Education, Cleaner Air, Cleaner Water, Convenience, Automated Accounting Principals, Enhancing the Reality Experience","Chatbot for sales and marketing, very basic idea however need to cater it for an african audience considering the scale at which whatsapp is used in this continent.",,"The most challenging projects I've worked on would likely be a game we tried to make as our 12th year final project in C++. We coded a pac-man like gameplay with some basic map and graphics. However at the time struggled to make automated/random ghosts chase the main character. We ended up pivoting to a different project due to the time constraints we had and made a book rental system to view, book and rent and buy.",,https://docs.google.com/spreadsheets/d/1jHAPaUruUYfo6NYC4IQPgRkqoDGgaM2z1y_JhhrSPtQ/edit?usp=sharing,https://storage.tally.so/private/Suraj_Kakkad_ikigai_template.pdf?id=xpNOLy&accessToken=eyJhbGciOiJIUzI1NiIsInR5cCI6IkpXVCJ9.eyJpZCI6InhwTk9MeSIsImZvcm1JZCI6IndkS2xXQSIsImlhdCI6MTc0MDEzMDY2N30.93SE2-5iIz47Gk7fqU1UQUflkzRmm_16DGjnPj3zF-w&signature=388ee6382cbc8d094934cec7205b0ee8f84e5d51e0dcf77b29dd01d7b1f2e57f
xO6VyE,NELdqO,2025-02-21 10:17:19,Tejas,tejassingh.inbox@gmail.com,1990-08-18,No,"I-72 (I Block), 7th Floor, Diamond District
Old Airport Road, Diamond District
BENGALURU, KARNATAKA 560008
India
Phone number: ‪9971066923‬",560008,https://storage.tally.so/private/WhatsApp-Image-Jan-22-2025-1-.jpeg?id=67QExJ&accessToken=eyJhbGciOiJIUzI1NiIsInR5cCI6IkpXVCJ9.eyJpZCI6IjY3UUV4SiIsImZvcm1JZCI6IndkS2xXQSIsImlhdCI6MTc0MDEzMzA0NX0.ekM4SneNNcBhzheYs9vRlcsGgDLQtomYZUkM0bh89Kc&signature=40c77ab278bdecc4235508a5ca995d5110e2c74a4340f679f45fc374dd615352,No,,,Startup,Founder,>10,"Currently, a founder exploring Consumer AI applications to understand how humans and AI NPCs would interact in mini virtual worlds in a variety of use-cases (Gaming, Fan fiction, etc.)

- Last held position - Senior Director of Product at ShareChat. Promoted 3 times in ~4.75 years. Grew a profitable livestreaming business - live audio chatrooms (ShareChat Live) and live video biz. (Moj Live) from $5M to $65M, contributing to ~50% of ShareChat's revenue. Was responsible for overall vision, product prioritisation and P&L. Played the de-facto role of a GM, wherein, in addition to Product management responsibilities, I vetted and collaborated on key tech, design, ops and finance decisions and responsible for growing revenue sustainably. Before live biz., I looked at supply side product initiatives for ShareChat and Moj, i.e. creator acquisition, retention and monetisation from the product side. Part of the starting team of Moj, short video platform, started when TikTok was banned in India.

- Previously, at RummyCircle, one of the top real money gaming companies in India for ~1.75 years - responsible for product-side new geography expansion initiatives to grow online Rummy product in newer geographies

- Before ISB, I was in a research and consulting role with Grail Research (Ex-Monitor Group), with Google, Microsoft and Panasonic as clients. Projects included, financial planning and analysis, competitive analysis and market entry projects.

ISB Hyderabad graduate (2018). Bachelors of Business Studies from Delhi University (2011)
",,"Understanding of how to use AI models to build, iterate and scale my own AI consumer business
Practical experience with major AI tools and platforms like OpenAI, Hugging Face, Stable Diffusion, and LangChain
Exposure/access to other folks from the AI community - founders, developers, designers, etc.",I've never coded,,,,,No,,Yes,Amateur,https://storage.tally.so/private/Tejas-Singh-Profile.pdf?id=Mbdpg0&accessToken=eyJhbGciOiJIUzI1NiIsInR5cCI6IkpXVCJ9.eyJpZCI6Ik1iZHBnMCIsImZvcm1JZCI6IndkS2xXQSIsImlhdCI6MTc0MDEzMzA0NX0.7Uj6qck32mdzZjkzsqM21vR2BKL_vDxpyuCiNEV4FlI&signature=18dabc6f268cb3d03d5273885df7a2204368c2e203ec388ca1f679e19e8af959,https://www.linkedin.com/in/tejassingh/,Entrepreneur Track (I want to build products),Yes,"Exploring AI x Consumer use-case around how can AI and humans interact with each other in an AI mini-world base don the below research paper - 

Generative Agents: Interactive Simulacra of Human Behavior (https://arxiv.org/pdf/2304.03442)",No-Code,,,,,,Speech Synthesis and Voice Assistants,,I am interested in speech to speech models and how AI characters (or NPCs) will interact with humans and other AI NPCs through speech which emulates a human-like experience.,,"Global warming, upskilling of labor market in the age of AI ",I have explored mental health and language learning in the market and how can it be revolutionized/democratized using AI,,"I have previously built audio and video live products and head of business at ShareChat. We are the largest interactive entertainment platforms in the country, outside AstroTalk.

Problems were around using Agora stack to serve real-time virtual gifting use-cases, so that gifters gifting to live creators can be gratified real-time and we can build immersive and engaging experiences.",,https://docs.google.com/spreadsheets/d/1DHsB5fAOkRF_oVsE9SHrbWuLNN4Qj0jQPD49FUwdS8w/edit?gid=0#gid=0,https://storage.tally.so/private/Screenshot-2025-02-21-at-3.47.00-PM.png?id=V01Rj6&accessToken=eyJhbGciOiJIUzI1NiIsInR5cCI6IkpXVCJ9.eyJpZCI6IlYwMVJqNiIsImZvcm1JZCI6IndkS2xXQSIsImlhdCI6MTc0MDEzMzA0NX0.AoX5q-I0pHPvq2ZRNcKxts7GCHcyRez1l0eI1U7KWzY&signature=6f5b5e505c04c8740121b859ea0e0e6a7b124848d9df0b20643fc786dec79b3d
dBVbWy,oQ6l9X,2025-02-22 10:27:12,Pratiksha,pratikshaa6668@gmail.com,1999-06-14,No,"Pavilion Residency wing b flat no 804 , Atul Patil, Behind balewadi stadium mhalunge pune ",411045,https://storage.tally.so/private/WhatsApp-Image-2025-02-22-at-2.25.22-PM.jpeg?id=pK0Nlb&accessToken=eyJhbGciOiJIUzI1NiIsInR5cCI6IkpXVCJ9.eyJpZCI6InBLME5sYiIsImZvcm1JZCI6IndkS2xXQSIsImlhdCI6MTc0MDIyMDAzNX0.GdHEG6qgtS2TgMofg0FTZRIDYNw2ezGcI2iXzZ-VvMI&signature=2e74bfc898a31c3aa50ff298d0b75aa9cb47b6daf333cb961c0c36406b6daf6e,No,,,TCS,Frontend Developer,1-3,I am Frontend developer working in react js HTML and css . My job is to create dynamic web apps and making them responsive and reusable components. ,,I am looking for a job opportunity to switch my career into Gen AI and would like to explore more in this fields. ,I'm familiar with coding,Yes,I've never used Python,"React , HTML, C, JS",1-3,No,,No,,https://storage.tally.so/private/Pratiksha-Patil.pdf?id=jy04lY&accessToken=eyJhbGciOiJIUzI1NiIsInR5cCI6IkpXVCJ9.eyJpZCI6Imp5MDRsWSIsImZvcm1JZCI6IndkS2xXQSIsImlhdCI6MTc0MDIyMDAzNX0._u37A0gLEGlFhGq-fk35EBdACJ3Ac-2Bk8U0YQsXuOA&signature=4b8326020b975d381cbff68db14353dd5d07d72e59ee9faa3faaa9bd7e00a8e5,http://www.linkedin.com/in/pratiksha-patil-718b2a159,Employment Track (Get a job / Up-skill in my career,,,Code,,Information Technology (IT),,Software Development,,E-commerce Personalization,,"Create AI tools to let user try cloths or makeup products without actually wearing them. By training personalized AI agent for user, based on their facial features it will suggest shades of makeup products etc. Use of an AI to make user's life for making choices correctly.","Gardening, writing my own thoughts, puts me into the flow state.",,,,,https://docs.google.com/spreadsheets/d/1QwrbKBu-n-U_YlayRWLJOe9D4mTu3ds6qaPqXjuJodQ/edit?usp=drivesdk,,https://storage.tally.so/private/The-Ikigai-Template-_-Recalibrate-How-You-Spend-Your-Time_Copy.pptx?id=xp08AE&accessToken=eyJhbGciOiJIUzI1NiIsInR5cCI6IkpXVCJ9.eyJpZCI6InhwMDhBRSIsImZvcm1JZCI6IndkS2xXQSIsImlhdCI6MTc0MDIyMDAzNX0.uPE6AAqHc-HfcDaZrYm0e3Sn_O-6srA1b3-P84Ya7KI&signature=b00354ea68951c94d4c952eb0bac475cb62baabc7fd2d1d6fc347edb2c929677
A15OWW,RlKOWv,2025-02-22 15:35:06,Rajkumar Kanagasabai,rajkumar@yuktrix.org,1994-12-27,No,"No: 101/51b, Kizhandai Street, Pallur Village & post, Arakkonam Taluk, Ranipet District ",631051,https://storage.tally.so/private/Raj-New.jpg?id=ly0ELB&accessToken=eyJhbGciOiJIUzI1NiIsInR5cCI6IkpXVCJ9.eyJpZCI6Imx5MEVMQiIsImZvcm1JZCI6IndkS2xXQSIsImlhdCI6MTc0MDIzODUwOX0.h-h8WitwH0AwdKpI-w8fLFmdeZQ1MBjiHdp9rZgMNFY&signature=5ca81a31346445b2a0fed4b3ac0d9978809af2231fade9581790c0454ac06bb2,No,,,Latentview Analytics,Assistant Manager,3-8,"I'm a seasoned Data Guy with over six years of hands-on experience in the entire data ecosystem—from engineering and visualization to machine learning and deep learning. Currently, I’m leading a consulting and service engagement worth over $4M for the US Healthcare sector.",,I aspire to forge an entrepreneurial career in the financial trading arena.,I'm familiar with coding,Yes,I'm well versed in Python,,3-8,No,,No,,https://storage.tally.so/private/Profile.pdf?id=N64jbQ&accessToken=eyJhbGciOiJIUzI1NiIsInR5cCI6IkpXVCJ9.eyJpZCI6Ik42NGpiUSIsImZvcm1JZCI6IndkS2xXQSIsImlhdCI6MTc0MDIzODUwOX0.Xr3PZqu9wOJHGKfBXj4YxVKisWUeP88FLZUe8lzG0Zc&signature=009c6dc8204d403de601ef8ef6d070c1ca65ea89addcdae5958b6c7b4837403b,https://www.linkedin.com/in/rajkumar-kanagasabai-03a332165/,Entrepreneur Track (I want to build products),No,,Code,,,,,,Financial Trading Algorithms,,"plan is to build an innovative, AI-powered algorithmic trading platform targeting Indian retail traders. You'll leverage your data science expertise to create a scalable, compliant solution aimed at simplifying trading decisions.",,"aims to empower Indian retail traders through an AI-driven algorithmic trading platform. It simplifies trading decisions, making advanced strategies accessible to everyone and change the way of how retail traders trade currently",Many but nothing in depth,,Not much,,https://docs.google.com/spreadsheets/d/1jHAPaUruUYfo6NYC4IQPgRkqoDGgaM2z1y_JhhrSPtQ/edit?gid=0#gid=0,https://storage.tally.so/private/Ikigai.png?id=pK08ME&accessToken=eyJhbGciOiJIUzI1NiIsInR5cCI6IkpXVCJ9.eyJpZCI6InBLMDhNRSIsImZvcm1JZCI6IndkS2xXQSIsImlhdCI6MTc0MDIzODUwOX0.gECO3KTMpgduaHkATW0Wny-oxaU1rF97EYlzXBbC9EI&signature=fa28801fc80d10f3752e188da21c3803af2c0ba7679dc9269c0ee82a2441bd2d
1qy1o4,grDP6P,2025-02-23 05:07:23,Rahul Mittal,rahulmittal901.rm@gmail.com,1995-05-13,No,"Sunil Kumar, Sikhan wala Road, Near Shekh Farid public school, Kotkapura, District: Faridkot, Punjab, India",151204,https://storage.tally.so/private/PXL_20230513_082503201.jpg?id=g0WGld&accessToken=eyJhbGciOiJIUzI1NiIsInR5cCI6IkpXVCJ9.eyJpZCI6ImcwV0dsZCIsImZvcm1JZCI6IndkS2xXQSIsImlhdCI6MTc0MDI4NzI0NH0.FXcAIYBLIpsmgFXE5tqh9Q25TTfICbh3l3Uc9XLRVz8&signature=3c4700662ff73f7cc66a397fead79d365cbdf1d5b88d42d1b774613609aa8f80,No,,,Unemployed,DevOps Engineer,3-8,I have worked for a DevOps/Cloud/SRE Engineer role in past 7 years.,,"Able to integrate AI frameworks in DevOps field.
",I'm familiar with coding,No,I'm well versed in Python,,3-8,No,,No,,https://storage.tally.so/private/Resume2025.pdf?id=YQVa2q&accessToken=eyJhbGciOiJIUzI1NiIsInR5cCI6IkpXVCJ9.eyJpZCI6IllRVmEycSIsImZvcm1JZCI6IndkS2xXQSIsImlhdCI6MTc0MDI4NzI0NH0.9Cg7cV9FsIDRdwojeqHK-UqQj2t47o0QBTqFEdQQPE0&signature=1844bfa0ea5880859362e474fe227ea940024bd060ed5410d2feda4b00746bd1,https://www.linkedin.com/in/rahul-mittal-9b7368125/,Employment Track (Get a job / Up-skill in my career,,,Code,,Information Technology (IT),,Technical Support,,Cybersecurity Threat Detection,,I want to upskill myself to monitor the infrastructure of company. ,I am working as DevOps/SRE Role for past 7 years. I think It's too late & risky to switch careers.,,,,,https://docs.google.com/spreadsheets/d/1FXEnDY19HlPTB3lfuqvxZ7aODiWwdAjF/edit?usp=sharing&ouid=104110819036201481509&rtpof=true&sd=true,,https://storage.tally.so/private/The-Ikigai-Filled_v1-_-Recalibrate-How-You-Spend-Your-Time.pptx?id=y6e9G6&accessToken=eyJhbGciOiJIUzI1NiIsInR5cCI6IkpXVCJ9.eyJpZCI6Ink2ZTlHNiIsImZvcm1JZCI6IndkS2xXQSIsImlhdCI6MTc0MDI4NzI0NH0.JjkvmR-HVXoBpwFqEl6sbL6ufJziPkO2icTzBaYHe1U&signature=041e3336c6acc9bffa335911deff7f599c7dcb45ec7e5fe91e78b4b181b7d79b
BMqBg5,Dyq9gN,2025-02-23 17:00:30,Vedanti Saxena ,vedanti3018@gmail.com,1996-01-30,No,"B3/278 - 201, Westwood Apartment , Near chirtrkoot statdium , chitrakoot , Vaishali nagar , Jaipur , Rajasthan",302021,https://storage.tally.so/private/WhatsApp-Image-2025-01-18-at-10.18.41-PM.jpeg?id=GdjbOe&accessToken=eyJhbGciOiJIUzI1NiIsInR5cCI6IkpXVCJ9.eyJpZCI6IkdkamJPZSIsImZvcm1JZCI6IndkS2xXQSIsImlhdCI6MTc0MDMzMDAzM30.0PuGAykfzm7rnZodUneYHPNo9vrBrfAvFrQFPV1lrrQ&signature=a0af227cc3a47737b2db18181a553192b8843e2fd40e2eb1e096aae7b271b2e1,No,,,Taggbox,Associate AI Engineer,1-3,"My professional journey began with a strong foundation in statistics and data analysis, where I honed my skills in extracting insights from complex datasets. Over time, I developed a deep interest in AI, driven by its transformative potential across industries. This passion led me to focus on building impactful AI systems.Moving forward, I aim to explore advanced areas like generative AI and deep learning.",,"I aim to gain a deeper understanding of advanced AI techniques, industry best practices, and scalable development approaches. I expect to enhance my problem-solving skills, collaborate effectively on challenging projects, and build a strong network of like-minded professionals along with applying these learnings to create innovative AI solutions.",I'm familiar with coding,Yes,I'm well versed in Python,,1-3,No,,No,,https://storage.tally.so/private/Vedanti-CV-1-.pdf?id=8QgXzx&accessToken=eyJhbGciOiJIUzI1NiIsInR5cCI6IkpXVCJ9.eyJpZCI6IjhRZ1h6eCIsImZvcm1JZCI6IndkS2xXQSIsImlhdCI6MTc0MDMzMDAzM30.uEh4a_St_Vp7XIcRSMX1oI2HHNq1kVr48Iv3nb3IMx4&signature=8706a05697300cac8789d1a83e916f87750e66adf4316fd79359e2a4a2165bd4,https://www.linkedin.com/in/vedanti-saxena-060972170/,Employment Track (Get a job / Up-skill in my career,,,Code,,Others,User Generated Content ,Data Science,,B2B SaaS Solutions,,"I want to use generative AI to improve user experience and automate tasks. I am interested in building AI solutions for content creation, personalized recommendations, and smarter customer interactions.","- Sketching and Painting 
- Listening to music
- Playing sports 
- Solving puzzle
- ",,,,,https://docs.google.com/spreadsheets/d/1Fg9J3-4l1bo7X-N17blpSARu-kTERCHW8nMLnqut_io/edit?gid=0#gid=0,,https://storage.tally.so/private/The-Ikigai-Template-_-Recalibrate-How-You-Spend-Your-Time_Vedanti.pptx?id=e69vv0&accessToken=eyJhbGciOiJIUzI1NiIsInR5cCI6IkpXVCJ9.eyJpZCI6ImU2OXZ2MCIsImZvcm1JZCI6IndkS2xXQSIsImlhdCI6MTc0MDMzMDAzM30.PmjC76B1aD39pWRMplkhnF10a6tTmhI2AYH4urfJVmg&signature=4f0aee8aefda36b061b070448033305cc13f12534fd7c57cf7cfb9d5a5d60c2d
