 ,Respondent ID,Submitted at,"Hey there! Could you share your name with us?
","What's the best email to reach you at? We'd love to stay in touch!
","When’s your birthday?
",Is your address outside India,"Want some awesome merch? Just drop your address below, and we'll send it your way!
",Pin code/Zip code,,"Are you currently a student? Let us know!
",Did you have any working experience before this?,"What’s your study stream? We'd love to hear what you’re passionate about!
For Ex - M.S in  AI and ML","Please share your Company/Organisation name
For Ex - Siemens","What is/was designation? 
For eg - Program Manager - Data and Operations",Total Years of Experience,Tell us little bit about your professional journey,What do you like in the course that you are pursuing?,What outcomes are you expecting after the cohort ends?,How familiar are you with programming/coding?,Is coding a part of your daily job?,How familiar are you with Python?,Which languages are your familiar with?,"How many years of experience do you have in coding/programming
","Have you used Stable Diffusion?
Stable Diffusion is a deep learning model that generates high-quality images from text prompts using a diffusion process to iteratively refine visual output.
",How familiar are you with Stable Diffusion?,"Do you have any experience in VFX or artistic tools in AI?
",How familiar are you with VFX or artistic tool in AI?,Resume,LinkedIn,"We have 2 Career Tracks in this cohort, which is your most preferred one?",Are you already a founder ?,"If yes, please give us some information about it ?","We have 2 Execution Paths in this cohort, which is your preferred one?","Give us your latest Designation and Domain.
For ex: Program Manager - Operations and Data",What Industry are you currently in,"Please specify
",What domain are you in?,"Please specify 
",What kind of products and industries are you interested in targeting using generative AI?,"Please specify 
","What would you like to do in that industry?
Instructions : Please provide a brief description of the product domains or industry sectors you are interested in or envision impacting with generative AI technology","What activities puts you into the flow state?
What is a flow state?","What issues or causes are you passionate about?
",Share the areas or ideas you're currently exploring and those you've explored in the past,What’s the most consequential belief you’ve changed your mind on in the past year? What made you change your mind?,"What’s the most challenging and impressive project or problem you’ve worked on? Please describe the problem in detail, the technical and non-technical hurdles you faced, and how you ultimately succeeded?
","Can you please make your personal tracker from this template and submit the link with view permissions?
Instructions: Please make a copy of the document, customize the columns marked with an asterisk (*), and share the link here.
Click here to get the template&gt;&gt;","Can you please make your personal tracker from this template and submit the link with view permissions?
Instructions: Please make a copy of the document, customize the columns marked with an asterisk (*), and share the link here.
Click here to get the template&gt;&gt;","Can you please make this IKIGAI chart?
Instructions: Please make a copy of the document, fill in the answers and upload it.
Click here to get the template&gt;&gt;"
reeLKN,2VXZAL,2025-01-17 14:25:19,Venkata Sandeep Jangiti,jvenkatasandeep@gmail.com,2001-03-23,Yes,"Hyderabad, Telangana, India",500055,https://storage.tally.so/private/Sandeep-Pic.1.jpg?id=DdPR5q&accessToken=eyJhbGciOiJIUzI1NiIsInR5cCI6IkpXVCJ9.eyJpZCI6IkRkUFI1cSIsImZvcm1JZCI6IndkS2xXQSIsImlhdCI6MTczODU3MTc1OH0.KhjZcvjcycSDQpffjksTWj17NpB0Oew2rLlNw3GHOVk&signature=6e7a38e642972987bc4b920ee8f5733d9cb9301eaea86aa38fc8593689404693,No,,,N/A,N/A,1-3,Completed my masters in Finance and looking after my dad's construction business as of now,,"Be more knowledgable than before in applied AI, and maybe come up with something to work on",I've never coded,,,,,No,,No,,https://storage.tally.so/private/Resume_Venkata-Sandeep-Jangiti.pdf?id=XWk6B4&accessToken=eyJhbGciOiJIUzI1NiIsInR5cCI6IkpXVCJ9.eyJpZCI6IlhXazZCNCIsImZvcm1JZCI6IndkS2xXQSIsImlhdCI6MTczODU3MTc1OH0.q-6O-qjtm5Kom1oGlVQrAdZ5NlpsiisUt6NDyEXVTHo&signature=80dcba755130977ff8f111157da1eeb9dad921a9dc71050619a6615e92d39724,www.linkedin.com/in/jvenkatasandeep,Entrepreneur Track (I want to build products),No,,Code,,,,,,B2B SaaS Solutions,,"It's either freelancing in B2B SaaS or working on integrating something with finance, or maybe something else!
TBH not so sure",,Well anything that make the work easier,Actually I am blank in the idea space,,"Not the most challenging, and not much of a project but there was this cohort in my university about entrepreneurship, we were grouped in 4 and were tasked to build an idea and present it to a panel at the end of the cohort. My group was completely different, we were from different countries, different ",,https://docs.google.com/spreadsheets/d/118r1BnVABzvAfnveUFj3abx28eVUtmjUrXAM9pbaOdc/edit?usp=sharing,https://storage.tally.so/private/Screenshot-2025-01-17-at-7.54.26-PM.png?id=k61BK1&accessToken=eyJhbGciOiJIUzI1NiIsInR5cCI6IkpXVCJ9.eyJpZCI6Ims2MUJLMSIsImZvcm1JZCI6IndkS2xXQSIsImlhdCI6MTczODU3MTc1OH0.AnIsvkuvhKRN6R1g7G22DfFAQ0t4TOPNv2v5CkoFr4w&signature=1f045030641e4bfdae93dd66ab04a002f2c612f3870470b5e3f72c7bf4ec98fc
RAOR7j,1BPgbW,2025-01-17 21:20:11,Akash Srivastava,artistakash.3d@gmail.com,1990-08-29,No,"C 1603, Sanghvi S3 Ecocity, Mahajan wadi , Near Ellora Studios, Mira Road, Mumbai",401107,https://storage.tally.so/private/Akash-Srivastava.png?id=Z6KpVz&accessToken=eyJhbGciOiJIUzI1NiIsInR5cCI6IkpXVCJ9.eyJpZCI6Ilo2S3BWeiIsImZvcm1JZCI6IndkS2xXQSIsImlhdCI6MTczODU3MTc1OH0.MLj0piCpwApFMdjvcIhcHEezJFVDAgq5Nz4EkwsUJeg&signature=b28a4636bf0065f09ab8900c52c298b669935438f9c47f528acb1773f63b4421,No,,,DNEG (Double Negative),VFX Pipeline Technology Trainer (ex VFX Software Developer),>10,"With background in engineering, i moved into VFX Industry to be a part of the creative world, then stumbled upon software development within VFX Industry workflows so upskilled myself and switched to become a VFX Software Developer, Currently in a position where i share my knowledge and train Software Developers in VFX Industry.",,I am looking at being able to create AI based web apps (for closed ecosystem) as well as AI based Custom Agentic Workflows.,I'm familiar with coding,Yes,I'm well versed in Python,,8-10,Yes,Intermediate,Yes,Intermediate,https://storage.tally.so/private/Akash_Srivastava_Resume_2022_1.pdf?id=LWNQa2&accessToken=eyJhbGciOiJIUzI1NiIsInR5cCI6IkpXVCJ9.eyJpZCI6IkxXTlFhMiIsImZvcm1JZCI6IndkS2xXQSIsImlhdCI6MTczODU3MTc1OH0.bYtL7KCZnRC-DZwOK8emOKwedUOO8a-9Ind2cPQa0a0&signature=8658c0d94caebb53eb0c077b7f306db7344f6ece6b5773629ce3947e09829a9f,https://www.linkedin.com/in/akash-srivastava-7b855485/,Entrepreneur Track (I want to build products),Yes,"I have recently started GamutX Academy, where i teach people the necessary skills required to start their journey as Software Developers in VFX & Animation Industry. 
Website : https://www.gamutx.com/ ",Code,,,,,,Educational Content Generation,,"I would like to create a product related to VFX & Animation Industry. anything to do with creative workflows, automate or build new 3d artists workflows, build tools powered by AI which can be embedded in their daily artistic workflows.",,"In next few months/years i am positive that there would be several AI based tools incorporated in 3D artist workflows, so I want to be in its forefront and help people/studios/companies adopt it, also i would want to close the skill gap in the VFX industry on the technical development side.","I don't have any idea related to VFX Industry currently, but since i am in education , there are problems that i have which i would like to have a solution for as an educator.",,"Throughout my career, from being a student, to VFX & 3D artist, to VFX Mentor, to VFX Software Developer and now a Founder. I have faced many things, i cant remember any one of it on top of my head, neither i want to look back at it, My belief is to look forward and learn from my mistakes. My approach is to find a way out by being at it and getting it done.",,https://docs.google.com/spreadsheets/d/1oysSLTKX23dNWSxgVUlhdrlP9JpML1MXkTm4QCMyj58/edit?usp=sharing,https://storage.tally.so/private/akash---The-Ikigai-Template-_-Recalibrate-How-You-Spend-Your-Time.pptx?id=jQqeG6&accessToken=eyJhbGciOiJIUzI1NiIsInR5cCI6IkpXVCJ9.eyJpZCI6ImpRcWVHNiIsImZvcm1JZCI6IndkS2xXQSIsImlhdCI6MTczODU3MTc1OH0.IHJ_XSNP-psRxkPkjm5W8z_sUqH4YFaT_CmZdfiUH2Q&signature=6142258ccebcf84a089c8c3f3efe1c090cb54c9dd5ee440b71f76ce9b61ab021
XpjvMg,WQrdye,2025-01-18 00:41:37,Gupil Bhutani,gupil.bhutani@gmail.com,1999-01-20,Yes,"206-2051, Prospect Street, Burlington, ON, Canada",L7R 1Z2,https://storage.tally.so/private/100.jpg?id=Mzqo4g&accessToken=eyJhbGciOiJIUzI1NiIsInR5cCI6IkpXVCJ9.eyJpZCI6Ik16cW80ZyIsImZvcm1JZCI6IndkS2xXQSIsImlhdCI6MTczODU3MTc1OH0.N5LNsm_Ch-5RpmZH4sC_rrzgkEOwrnaQQu-RKXxNbL4&signature=390387e1c258b40d6372f4aac3f06e9b26958617c193ba984f111806684feeb0,No,,,Wishpond (TSXV:WISH),VP of Marketing,3-8,"I started to venture into Cyber Sec, Got bored in the second year of engineering, and Joined a Digital Marketing Demo Class, Then Joined the Cohort, and graduated Top 3 of it.

Moved from Digital Marketing to Growth Marketing to Product Management & Growth, and, Loved it.

Graduated GrowthX Top 3, Showed KekaHR Team how to go from $12 Million in ARR to $24 Million in 12 Months.

It kept moving needles in my professional journey, when I decided to go back to learn more code and full stack development, and Ran into you guys, was a big fan of Replit and AI-based Coding and Thought, this may be the best bet for my SaaS business.",,To build my SaaS MVP and Secure Venture Funding.,I've never coded,,,,,Yes,Amateur,Yes,Amateur,https://storage.tally.so/private/Gupil-Bhutani-2024.pdf?id=06yprA&accessToken=eyJhbGciOiJIUzI1NiIsInR5cCI6IkpXVCJ9.eyJpZCI6IjA2eXByQSIsImZvcm1JZCI6IndkS2xXQSIsImlhdCI6MTczODU3MTc1OH0.S56axOLr1ATJXoes1S3SBetmG5IICJP2d-csa1AHuyI&signature=66158e6502c4589c09da44dac699ad5b93a237d7891c011d5143c0f86d208ea4,https://www.linkedin.com/in/gupil-bhutani/,Entrepreneur Track (I want to build products),Yes,Lookup echelongrowth.com (It's where I consult as a Side Hustle),Code,,,,,,B2B SaaS Solutions,,"Build a Completely Automated and Well Versed Nuanced GTM Automation platform that helps close sales, with the Intent of conversion behind it.",,"Solving for Revenue and Solving for Business Growth, Giving other Businesses an option, on what works and what doesn't before they go out on the battlefield.","Lookup clay.com, unifygtm.com, databar.ai, trigify.io, fyber.ai. and Consider all that, instead of Just Email but Pan marketing.",,"Building Growth Project for Keka HR to take them from $12 Million to $24 Million in 12 Months.

Managed a cross-functional team of 9 to get to that level.",,https://docs.google.com/spreadsheets/d/1txP_KpbmIqgXM3vMgDjMRiPXUJQuKzAZf6CEFDThnx8/edit?usp=sharing,https://storage.tally.so/private/Ikigai-Chart.png?id=y9p2L6&accessToken=eyJhbGciOiJIUzI1NiIsInR5cCI6IkpXVCJ9.eyJpZCI6Ink5cDJMNiIsImZvcm1JZCI6IndkS2xXQSIsImlhdCI6MTczODU3MTc1OH0.t0vrKP-bz1cy64diIC5yjSy9bMMG44k3qc1o0fWhavQ&signature=2210c6b4a0b054407898ec6641b7181a3eefd05cb10da57a9ad6db20de3fc3ba
5JRpEb,VqQl2g,2025-01-18 07:20:50,Shreyansh Doshi,shreyansh.doshi010@gmail.com,1994-06-28,No,"B-705, Happy Palace, Near Saint Tulsidas Garden, L.H.Road, Varachha, Surat, Gujarat",395006,https://storage.tally.so/private/WhatsApp-Image-2022-09-16-at-08.34.22.jpeg?id=bxEkx7&accessToken=eyJhbGciOiJIUzI1NiIsInR5cCI6IkpXVCJ9.eyJpZCI6ImJ4RWt4NyIsImZvcm1JZCI6IndkS2xXQSIsImlhdCI6MTczODU3MTc1OH0.8t1poB1AVLeSohDQl5e55aWPpEb36y40zVfHfQPE1DM&signature=4fca2daa0d4be82ed918a9ed368f8e2901938381f0c83681e81ce6f8a1920afc,No,,,Samvara Technologies,Founder,8-10,"I have over 9 years of experience in software development, primarily focused on building robust and scalable products. My expertise lies in designing and developing systems such as CRM, CMS, SaaS platforms, ERP solutions, and MVPs.",,I want to be able to build AI enabled web/mobile apps and systems for the startups,I'm familiar with coding,Yes,I've never used Python,"Node.js, PHP, Javascript",8-10,No,,No,,https://storage.tally.so/private/Shreyansh-Doshi---Portfolio.pdf?id=P5WEE1&accessToken=eyJhbGciOiJIUzI1NiIsInR5cCI6IkpXVCJ9.eyJpZCI6IlA1V0VFMSIsImZvcm1JZCI6IndkS2xXQSIsImlhdCI6MTczODU3MTc1OH0.3sIw_vxWblBbBcNtUvZtu7ksfv5N2qS-NhW196AYj-g&signature=187e1346ebbf5d9ff21d7417ec467a8a8079f504f9560b89b98b2f0584d114aa,https://www.linkedin.com/in/shreyansh-doshi/,Entrepreneur Track (I want to build products),Yes,I am a CTO of one of the Goa based startup named OneBoard. Its operating in travel/tourism space and its a B2B2C product.,Code,,,,,,B2B SaaS Solutions,,I aim to collaborate with visionary founders to deliver tailored AI-enabled SaaS solutions that meet their specific requirements.,,"I love to help non-tech founders to create SaaS type of solutions by analysing their requirements. Industry wise I like Education, Travel and Real-Estate.",Currently I am developing MVP for one of the US based startup operating in Fitness industry.,,"The current MVP I am developing named Gymble. Client is fully non-technical so he only had a notion document. I had to analyse the requirements, create base level wire-frames in excel, and then after approval I have created features.

Technically no big challenge as of now  as this product is a lot similar to the previous product we developed.",,https://docs.google.com/spreadsheets/d/190uIhguQDOmxs2wNithUPZuoLaKVLfuNFdTjeijjLt8/edit?usp=sharing,https://storage.tally.so/private/Ikigai-Template-_-100x.pptx?id=xaLZaJ&accessToken=eyJhbGciOiJIUzI1NiIsInR5cCI6IkpXVCJ9.eyJpZCI6InhhTFphSiIsImZvcm1JZCI6IndkS2xXQSIsImlhdCI6MTczODU3MTc1OH0.BwaAhtCWKo1e0OCZ4U3korFq6wEK1cLC6HSfQi3ISuY&signature=c7e0e2ff59ed5f9a1b705871c9e220bb213cb08bad8de3fef77526b3f3e7f9ac
8XOD9r,64jWkA,2025-01-18 09:28:19,Sughosh P Dixit,sughoshpdixit@gmail.com,1998-09-08,No,"#69, Sri Krishna Nilaya, 1st Cross, Vidyamanyanagar, Andrahalli, Vishwaneedam Post, Bengaluru - 560091",560091,https://storage.tally.so/private/out-0-13-.webp?id=W5kPlL&accessToken=eyJhbGciOiJIUzI1NiIsInR5cCI6IkpXVCJ9.eyJpZCI6Ilc1a1BsTCIsImZvcm1JZCI6IndkS2xXQSIsImlhdCI6MTczODU3MTc1OH0.xe57bCTfK7acC69lx0xmxE_ShzEdLBnZcMcSc_Cmvqo&signature=38ae55af4f768bd09faddaa6c08c44338acd01fe42f6d62a3c3d56eb033da9e5,No,,,Oracle,Data Scientist,3-8,"🔍 Data Scientist at Oracle | Data Science Enthusiast | Masters in Data Science & Engineering

🌟 Transitioning from a Senior Analyst role to Data Scientist at Oracle Financial Services Software, specializing in Financial Crimes and Compliance Management (FCCM). With over 4 years of experience in leveraging data for actionable insights and fraud detection, I am passionate about solving complex financial problems using Machine Learning for Anti-Money Laundering (ML4AML) solutions.

Recently completed a Masters in Data Science and Engineering from BITS Pilani, balancing academic excellence with a full-time role. Skilled in advanced data science techniques, including predictive modeling, deep learning, and big data analytics.

🔹 Proven track record in data science, with practical experience in web development, problem-solving on Kaggle, and building real-world AI-powered applications. Proficient in exploratory data analysis (EDA), feature engineering, and machine learning algorithms. Strong background in statistical methods, hypothesis testing, and complex SQL/PLSQL queries. Skilled in data visualization using tools like SQL, Excel, and developing BI reports and Oracle APEX applications. Successfully implemented advanced analytics solutions and Oracle Digital Assistant chatbots for HCM modules.

🔹 Technical proficiency in SQL, Python, Pandas, and NumPy, with a deep understanding of data preprocessing, model evaluation, and optimization. Experienced in financial crime risk analytics and fraud detection using AI/ML models. Strong communication skills and a collaborative team player with a service-oriented mindset. Eager to connect with professionals in Data Science, Financial Technology, and Compliance Management to share insights and explore new opportunities.

#DataScience #Analytics #TechEnthusiast #FinancialCrimeDetection #Innovation #ContinuousLearning🔍 Data Science",,"I aim to leverage this course to excel in my current role as a data scientist, build a strong personal brand in AI/GenAI, and explore better career opportunities. Additionally, I want to expand my presence on platforms like YouTube and Instagram, focusing on tech topics such as Data Science, AI, and ML, as well as football and classical music, where I specialize. My goal is to grow holistically as a professional and content creator.",I'm familiar with coding,Yes,I'm well versed in Python,,3-8,Yes,Amateur,No,,https://storage.tally.so/private/Sughosh-Dixit-Resume-v9.pdf?id=EQrLgr&accessToken=eyJhbGciOiJIUzI1NiIsInR5cCI6IkpXVCJ9.eyJpZCI6IkVRckxnciIsImZvcm1JZCI6IndkS2xXQSIsImlhdCI6MTczODU3MTc1OH0.6vQCNcOw-tv9WzZgIH5jvUW5qacKkeAFIAiziAMLz0g&signature=90bcda2f4cb812f06712a1b95ae63d2951cad16883fa2cf725e12d18aa2fd1d2,https://www.linkedin.com/in/sughosh-dixit/,Employment Track (Get a job / Up-skill in my career,,,Code,,Finance and Banking,,Data Science,,Content Creation for Social Media,,"I'm interested in using generative AI to revolutionize content creation for social media by automating and enhancing creative processes. This includes generating engaging visuals, personalized video scripts, and music compositions to elevate tech-focused content (Data Science, AI, ML), football insights, and classical music performances. My goal is to build tools or platforms that help creators produce high-quality, customized content efficiently while maintaining authenticity.","Playing football, singing music specifically classical music.",,,,,https://docs.google.com/spreadsheets/d/1JkhXiWe5N9DPuoxzApRfmiU2iT1EwIjR/edit?usp=sharing&ouid=117902380334310511693&rtpof=true&sd=true,,https://storage.tally.so/private/Sughosh-The-Ikigai-Template-_-Recalibrate-How-You-Spend-Your-Time.pptx?id=jQqW21&accessToken=eyJhbGciOiJIUzI1NiIsInR5cCI6IkpXVCJ9.eyJpZCI6ImpRcVcyMSIsImZvcm1JZCI6IndkS2xXQSIsImlhdCI6MTczODU3MTc1OH0.JLKqM4X_UQbfIhqfI3YggmaexNtbuO8vspTR5XaG3OM&signature=52f6a80c3a228b8d9e995c131ae3175c197e2718d7c687a1ae82c276ee103278
AEZZGo,gO9xeP,2025-01-18 10:46:23,Harsha Shivakumar,Harshaenator@gmail.com,1987-09-17,No,"Door No 1407, 1st floor , 23rd main Road Banashankari 2nd stage near BDA Complex
Bengaluru",560070,https://storage.tally.so/private/HarshaSelfie.jpg?id=06gJNj&accessToken=eyJhbGciOiJIUzI1NiIsInR5cCI6IkpXVCJ9.eyJpZCI6IjA2Z0pOaiIsImZvcm1JZCI6IndkS2xXQSIsImlhdCI6MTczODU3MTc1OH0.xc5FzXuhGBp0qkV7PfjhJvTOPAY6zVk9YqSOgEBl7mk&signature=567147173479ef45af45d1161306d7338d617554e25b913befa2289e8376c241,No,,,SAP,Senior Technology Consultant,>10,"With 15 years of diverse experience in the software industry, my career began at Infosys through campus placement, where I contributed to projects in the finance and insurance sectors. I then transitioned to Hewlett-Packard (HP), where I worked with Oracle WebCenter Sites (WCS) in the telecom domain, specifically focusing on OSS/BSS solutions.

My journey with SAP Commerce started at BORN Group, where I worked extensively on B2B and B2C projects using the SAP Commerce framework. Building on this expertise, I joined SAP India Pvt Ltd as a Senior Technology Consultant/Lead, specializing in SAP Commerce and driving impactful solutions for enterprise clients.

Currently, I am exploring the transformative potential of AI technologies and focusing on incorporating AI capabilities into my career to spearhead business transformation initiatives. Looking ahead, my goal is to expand my expertise in AI development and seamlessly integrate it into enterprise applications, delivering innovative, intelligent solutions that drive value for businesses.
",,"After completing the AI cohort, I anticipate achieving several key outcomes that will significantly enhance my professional growth and technical capabilities:
	1.	Practical Proficiency in AI Implementation: I aim to gain hands-on experience in building and deploying AI-driven solutions, including integrating machine learning models into enterprise-level applications, particularly within the SAP Commerce ecosystem.
	2.	Expanded Solutioning Skills: By understanding advanced AI concepts, I hope to enhance my ability to design innovative, intelligent solutions that address complex business challenges, making customer experiences more personalized and efficient.
	3.	Confidence in AI Tooling and Frameworks: This cohort will deepen my expertise in leveraging AI platforms like SAP AI Core and Launchpad, equipping me to propose and deliver impactful AI projects confidently.
	4.	Strategic Insight: I expect to better understand how to align AI capabilities with business objectives, helping organizations transition to more data-driven, intelligent decision-making frameworks.
	5.	Thought Leadership: This program will enable me to become a stronger advocate for AI adoption in my organization and among clients, sharing best practices and contributing to the digital transformation journey.
",I'm familiar with coding,Yes,I've never used Python,Java,<10,No,,No,,https://storage.tally.so/private/Harsha-Shivakumar-Resume.docx?id=NW9BpB&accessToken=eyJhbGciOiJIUzI1NiIsInR5cCI6IkpXVCJ9.eyJpZCI6Ik5XOUJwQiIsImZvcm1JZCI6IndkS2xXQSIsImlhdCI6MTczODU3MTc1OH0.6sG18ZnwBP8a9nwVv0AZoSkQBmILUy8-2DeYFYqi0gg&signature=44dcc645a762da55eaeb3f50d26bb60feee43f3dbe00c7c355e490d4ffbf6bd3,https://www.linkedin.com/in/harrsha-sivakumaar-b9928b20b/,Entrepreneur Track (I want to build products),No,,Code,,,,,,E-commerce Personalization,,"I am keen to leverage generative AI technology to transform product domains such as e-commerce, retail, and supply chain management. By integrating AI-driven personalization, predictive analytics, and intelligent automation, I aim to enhance customer experiences, optimize inventory management, and streamline operations.

Additionally, I am passionate about exploring the potential of generative AI in industries like finance and telecommunications, particularly in areas like fraud detection, dynamic pricing, and automated customer interactions.

Ultimately, my goal is to deliver innovative AI-powered solutions that not only address current business challenges but also create new opportunities for growth and efficiency across diverse industry sectors.",,"I am deeply passionate about leveraging technology to drive meaningful change, particularly in areas that promote sustainability, inclusivity, and innovation. Some of the causes I am passionate about include:
	1.	Sustainable Technology Solutions: Building eco-friendly digital frameworks that reduce carbon footprints and promote energy efficiency across industries.
	2.	Equal Access to Technology: Bridging the digital divide by enabling underserved communities to access and benefit from cutting-edge technologies, such as AI and cloud solutions.
	3.	AI Ethics and Responsibility: Advocating for the ethical use of AI, ensuring that systems are transparent, fair, and inclusive, while minimizing bias and unintended consequences.
	4.	Empowering Businesses with AI: Helping organizations embrace AI to drive transformation, improve operational efficiencies, and deliver exceptional customer experiences.
	5.	Education and Upskilling: Supporting initiatives that provide learning opportunities in emerging technologies, enabling individuals to unlock their potential and thrive in a rapidly changing world.
",None,,none,,https://docs.google.com/spreadsheets/d/1xozupm1HFblgL3VfbrmSKMPa2gM0cF-N-YXrfhuOy_c/edit?usp=drive_link,https://storage.tally.so/private/Harsha---The-Ikigai-Template-_-Recalibrate-How-You-Spend-Your-Time.pptx?id=jQq9BY&accessToken=eyJhbGciOiJIUzI1NiIsInR5cCI6IkpXVCJ9.eyJpZCI6ImpRcTlCWSIsImZvcm1JZCI6IndkS2xXQSIsImlhdCI6MTczODU3MTc1OH0.gm1hxMsS7sK3FeTQn4T8O_kr6vyu0m5AXFur6mkWNzY&signature=4d119e62dbc1c44f3140c694477253b7fe1c84a3e30391db3a89432f0fa33ee0
