b0z5qe,qep922,2025-03-05 16:47:44,Sandeep Reddy Kandala,sandeep.k.kandala@gmail.com,1995-04-30,No,"107, Block B, The Nest Pranit Happy Homes, Nizampet,Hyderabad, Telangana",500085,https://storage.tally.so/private/WhatsApp-Image-2025-02-14-at-1.23.45-AM.jpeg?id=1llb0g&accessToken=eyJhbGciOiJIUzI1NiIsInR5cCI6IkpXVCJ9.eyJpZCI6IjFsbGIwZyIsImZvcm1JZCI6IndkS2xXQSIsImlhdCI6MTc0MTE5MzI2Nn0.iJ2k5WWg5ywpFkP4Gf_g2eEvf196Ihk5hkODjnJO2LA&signature=c5541916740c0c5e379f3a4184308e5519de4f7bcbefa87394d0953523e41e07,No,,,PWC,Senior Associate,8-10,Worked in multiple MNCs and a startup company as Integration developer.,,I am choosing entrepreneurship track. I want to build an personalized AI app for students to help with their learning.,I'm familiar with coding,Yes,I've never used Python,"SQL, DWL",3-8,No,,No,,https://storage.tally.so/private/Profile.pdf?id=2e7qQe&accessToken=eyJhbGciOiJIUzI1NiIsInR5cCI6IkpXVCJ9.eyJpZCI6IjJlN3FRZSIsImZvcm1JZCI6IndkS2xXQSIsImlhdCI6MTc0MTE5MzI2Nn0.Z2lc_WzNOcvEtDw1bSvKL8XQejWUt31iRlEbzmo_pMM&signature=7b2ded4269b0f5f3dd3e6226f4904cfb92aeed26e82482c34ff6a90b74b806ff,https://www.linkedin.com/in/sandeep-reddy-0b1404193/,Entrepreneur Track (I want to build products),No,,Code,,,,,,Educational Content Generation,,I would like build a personalized AI assistant for students to help with their learning and track their growth.,,"- Employment issues for freshers
- Personalized learning for students","A personalized AI assistant for students to help with their learning and track their growth with features like,
- Voice enabled personal assistant 
- Analyze and focus on topics where student is struggling
- Everyday quick knowledge checks
- Reports to parents

Some feature like overall growth tracking for teachers and school managements.",,"I have co-founded a gifting and event management company. We have faced challenges to get customers at the start, we have met a lot of convention centers and party places to collab with them to gain customers.",,https://docs.google.com/spreadsheets/d/1FBTUnaxanQSEUM7erlImyxP3w0WhffMiYYGWsFvXX4c/edit?usp=sharing,https://storage.tally.so/private/Sandeep-Ikigai.pptx?id=48DXVY&accessToken=eyJhbGciOiJIUzI1NiIsInR5cCI6IkpXVCJ9.eyJpZCI6IjQ4RFhWWSIsImZvcm1JZCI6IndkS2xXQSIsImlhdCI6MTc0MTE5MzI2Nn0.tUEDpNpVpZdWrDAAZWTowpNYAL2_opM8uwZ2m4iiFRU&signature=ac0538731fe7faf146dbe64a8ad100669264de5814472f667b21406131369b25
NePpXW,OygR1p,2025-03-05 16:48:13,Cherag Shah,chiragbs@gmail.com,1981-07-23,No,"504, rustomjee pinnacle, rajendranagar, borivali-east, mumbai",400066,https://storage.tally.so/private/CheragShah_ProfilePic.PNG?id=jyqD7x&accessToken=eyJhbGciOiJIUzI1NiIsInR5cCI6IkpXVCJ9.eyJpZCI6Imp5cUQ3eCIsImZvcm1JZCI6IndkS2xXQSIsImlhdCI6MTc0MTE5MzI5NX0.ZRNhS7r89VRekr6qUKPbJcQNxJTHyHD1aO-pqc_DV_k&signature=00666e6599f67112966656b4113587a52a027e39b1be4dbe92f94e150d30d31e,No,,,Templar Shield,CTO,>10,"As a seasoned Chief Transformation Officer with 22 years of experience in risk management, compliance, and information security, I have led transformative initiatives that have streamlined operations and enhanced compliance frameworks for Fortune 500 companies. My core expertise lies in integrating innovative technologies and strategies to mitigate risks, ensure robust regulatory adherence, and drive business growth. I am passionate about fostering resilient, future-ready organizations through strategic transformation and continuous improvement.

Key Accomplishments:
• I have cultivated strategic relationships with C-suite executives, enhancing client engagement and satisfaction, which led to a 15% increase in client retention and repeat business.
• By implementing automation tools and streamlining processes, I increased cross-functional workflow efficiency by 30%, resulting in a 20% reduction in project completion time.
• Through strategic client engagements, delivery excellence, and targeted marketing campaigns, I generated over $50M in revenue, surpassing revenue targets by 25% in the first year.
• I engineered comprehensive compliance programs, leveraging data analytics to enhance risk management by 35% and ensuring full regulatory compliance for Fortune 500 companies, all while driving significant business growth.
• By championing the adoption of innovative risk mitigation technologies, I successfully decreased regulatory penalties by 60% and facilitated 25% growth in business revenue.
• I pioneered technology-driven compliance strategies, enhancing regulatory adherence by 50% and boosting operational efficiency by 30% for top-tier global corporations.

CORE EXPERTISE:
Governance, Risk & Compliance (GRC) | Cloud Computing | Information Security Architecture | Data Science | Technical Delivery Excellence | Strategic Business Development | Automation & Process Improvement | Team Building & Leadership | Client Relationship Management",,"have been using the emerging technologies for a long time. i ant to use AI to develope (or work with team to get it developed) risk and goivernance platform which can work with farm of various crm, it helpdesk, policies and risk profiling platforms. ",I'm familiar with coding,No,I've never used Python,have coded 14 years back in vb++,3-8,Yes,Intermediate,No,,https://storage.tally.so/private/Chirag-Shah.pdf?id=48DXzB&accessToken=eyJhbGciOiJIUzI1NiIsInR5cCI6IkpXVCJ9.eyJpZCI6IjQ4RFh6QiIsImZvcm1JZCI6IndkS2xXQSIsImlhdCI6MTc0MTE5MzI5NX0.4QULvQDX6DNfocFzIA67mC-34ReNGcXX9DSGhHorSPU&signature=c59af4f3281bf9f71fec9487df1bd46a29da86445202da9f23831b404c934280,https://linkedin.com/in/cheragshah,Entrepreneur Track (I want to build products),Yes,three oracle is my company name and want to use help of AI for develping GRC & cyber security product,No-Code,,,,,,Cybersecurity Threat Detection,,GRC & cyber security,,"I am director with TINTE (this is not the end) which is for working with stray animals on roads in mumbai and want it to grow across india. 
",GRC & cyber security,,"migration of 7 platforms including policy, compliance, risk management, BCP/DR, third party risk, VRM, cyber safe data form 7 platforms, SmartSuite, Archer, ServcieNow, MS GRC, IBM OpenPage and SAP GRC in a single paltform of ServcieNow. WHen i was EVP with PNC bank at the time of merger. The merger was completed in 9 months so i was leading the complete risk profiling under CRO and also leading this paltform merger. COmpleted it in 850K USD as compared to initial plan of 7.2M USD",,https://docs.google.com/spreadsheets/d/1BNnawx-dWrEXXl_dj3iNIZ7kN9ms0z_RLMKiaBw2zFk/edit?usp=sharing,https://storage.tally.so/private/CheragShah_The-Ikigai-Template-_-Recalibrate-How-You-Spend-Your-Time.pptx?id=g0xjo4&accessToken=eyJhbGciOiJIUzI1NiIsInR5cCI6IkpXVCJ9.eyJpZCI6ImcweGpvNCIsImZvcm1JZCI6IndkS2xXQSIsImlhdCI6MTc0MTE5MzI5NX0.bgPf3-EDBR3SkpIg6z8fNApIMo3VtvAjX1HZyKGhQu0&signature=4174ece3fd6f7234d589506d8c4613b65c9eb1998bf599a7003a2d432d0e0443
plzbkJ,Mg6zZk,2025-03-05 16:51:07,Lokesh Reddy Dodla,lokeshreddy1631@gmail.com,2004-10-28,No,"4-41-220, rd 11/c, papireddynagar, kukatpally, hyderabad, Telangana",500072,https://storage.tally.so/private/PXL_20250205_125721281.MP~2-1-.png?id=kyy5Br&accessToken=eyJhbGciOiJIUzI1NiIsInR5cCI6IkpXVCJ9.eyJpZCI6Imt5eTVCciIsImZvcm1JZCI6IndkS2xXQSIsImlhdCI6MTc0MTE5MzQ3MH0.iUue2ZGKFvzCEDj_cRQ6uyaezpTnGkvO3BygSxjUx0E&signature=70bcade3ec7a0eb50b638665eb5928b84ba276a4a9d3a452e6f9c96afd37d66f,Yes,No,B.Tech in Computer Science,,,,,,"learn more about agents, build AI automations, get into a good job or start a single person led saas",I'm familiar with coding,,I'm well versed in Python,,1-3,Yes,Amateur,Yes,Amateur,https://storage.tally.so/private/Lokesh-Reddy-Dodla.pdf?id=8KQxJO&accessToken=eyJhbGciOiJIUzI1NiIsInR5cCI6IkpXVCJ9.eyJpZCI6IjhLUXhKTyIsImZvcm1JZCI6IndkS2xXQSIsImlhdCI6MTc0MTE5MzQ3MH0.cSaaNydNtthpd5pjr4toCc5aiXTyfeb6YwvyC4g6FcM&signature=391994f58a14d1a5423f9f1e7e3818afa3f3295aed0b780b30f227378cf9c6b7,https://www.linkedin.com/in/lokesh-reddy-dodla/,Employment Track (Get a job / Up-skill in my career,,,Code,,,,Engineering,,B2B SaaS Solutions,,"i would like to build saas products that would help 2 business contact and process automaticcally without involvent of human work more, or create a saas solution that would help customers in solving a particular problem. I would like to help brands grow","I enter a flow state when I am working on designing, gaming, or coding for my personal projects. I thrive when I have the freedom to explore new things through research and hands-on experimentation. I prefer working alone in a quiet environment, where I can focus deeply without interruptions. Medium-to-hard challenges keep me engaged, especially in areas where I already have expertise, though I am always open to trying new things. Recognition motivates me, and competition pushes me to go faster and surpass others. I get into flow most easily when working on AI-related projects, researching new concepts, and solving technical problems at my own pace.",,,,,https://docs.google.com/spreadsheets/d/1T8ZuZ9eCAr14-ho5xPxIry5THElUQFQmUxh7ObLGir0/edit?usp=sharing,,https://storage.tally.so/private/lokesh-ikigai.pptx?id=P6Wj6e&accessToken=eyJhbGciOiJIUzI1NiIsInR5cCI6IkpXVCJ9.eyJpZCI6IlA2V2o2ZSIsImZvcm1JZCI6IndkS2xXQSIsImlhdCI6MTc0MTE5MzQ3MH0.D_nt7FdB24FncEjhnf_quZQqfiH9x9zWJQ9E05Tfd6s&signature=f0d8144669a8d634a2052da90b979e7be127e3f81936ee43faa938a7b163e946
5yVBab,15xjGQ,2025-03-05 16:53:03,Vamsi Reddy,lvamsireddy@gmail.com,1993-10-02,No,"Vamsi Reddy
MIG 85, Housing Board Colony
Guntakal, Anantapur Dist
Andhra Pradesh 515803",515803,https://storage.tally.so/private/WhatsApp-Image-2025-03-05-at-11.37.43-AM.jpeg?id=jyqDpY&accessToken=eyJhbGciOiJIUzI1NiIsInR5cCI6IkpXVCJ9.eyJpZCI6Imp5cURwWSIsImZvcm1JZCI6IndkS2xXQSIsImlhdCI6MTc0MTE5MzU4NX0.-7dJB1WS78va_HqkAyZBDKeadnFj11MGnXpMpVcfxBA&signature=cdafd5a17d32cbbdfe1bc68fafc49b4debc5437da2653a79cdfe0d1ce5225483,Yes,Yes,Electronics and Instrumentation,,Inspector of Incometax,3-8,Working as incometax inspector earlier and now pursuing MBA,,AI product manager and building my own AI products,I'm familiar with coding,No,I'm well versed in Python,,>1,No,,No,,https://storage.tally.so/private/Vamsi_Reddy-CV-Prodman-.pdf?id=EXrzE2&accessToken=eyJhbGciOiJIUzI1NiIsInR5cCI6IkpXVCJ9.eyJpZCI6IkVYcnpFMiIsImZvcm1JZCI6IndkS2xXQSIsImlhdCI6MTc0MTE5MzU4NX0.sp9xGFX_LfzJmYGIDJ7V99-6NMD54_wjNW6aNc66Rwg&signature=35b60b17798b6f9de4c794ca3ebaa6ff64a709caf4cc5e4d71be33c8d6e01e51,https://www.linkedin.com/in/vamsi-reddy-mba/,Employment Track (Get a job / Up-skill in my career,,,No-Code,,Healthcare,,Data Science,,Others,AI Product Management,I want to build Gen-AI products at my workplace,Doing something challenging like solving problems and puzzles,,,,,https://docs.google.com/spreadsheets/d/1iG5R-P2rFPhx-BW0VFpJ0i1iVCNHz4an1cHI1ubTIZE/edit?usp=sharing,,https://storage.tally.so/private/Copy-of-The-Ikigai-Template-_-Recalibrate-How-You-Spend-Your-Time.pptx?id=d64Wqz&accessToken=eyJhbGciOiJIUzI1NiIsInR5cCI6IkpXVCJ9.eyJpZCI6ImQ2NFdxeiIsImZvcm1JZCI6IndkS2xXQSIsImlhdCI6MTc0MTE5MzU4NX0.mdjV-BWvF5-eLqIxMEQbkERQizgameoh2bsVMVwRKrs&signature=efcdd7d9f8f67b0cc73847d95f2d3419f0b46c31d636691c540f488aeaba3fde
d5zbRK,grp2jl,2025-03-05 16:58:46,Naman Shukla,gh@3mindsdigital.com,1993-09-20,No,"A-401, Santur Aspira, C2 Block, Palam Vihar, Gurugram, Haryana",122017,https://storage.tally.so/private/Naman-Formal.jpeg?id=a6g74y&accessToken=eyJhbGciOiJIUzI1NiIsInR5cCI6IkpXVCJ9.eyJpZCI6ImE2Zzc0eSIsImZvcm1JZCI6IndkS2xXQSIsImlhdCI6MTc0MTE5MzkyOX0.Yk036QGB2-W1---IDAgJT1UcSi_krmwZShmHOqhyv3Y&signature=623ed8ac63333127c43bb3a79eb0a5160c48cde0cbd274ed162c98e92fbf2da4,No,,,3 Minds Digital,Co-founder & COO,>10,"Great question! Helped me introspect a bit :)

So, my journey has been a full-on rollercoaster ride!  Graduated as a product designer a decade ago, transitioned into UX/UI Design at an early stage of my career.

Then I came on board as a founding team member at 3 Minds Digital(a full service digital agency) back in 2016, worked solo for the initial few months followed by building & leading a team of successful UX/UI designers for the next 3 years, while shipping some kickass products & websites! 

After handing over the team to a capable HOD, my focus shifted towards strategic growth of the company. 

Since the last 5+ years, the focus has been on Business Development - onboarding key clients such as Jockey, AnandRathi, Titan, and numerous other enterprises and startups alike.

Now, when our agency's journey from 0-1 and 1-10 is complete, it is time to go all-in for 10-100 exponential growth, to achieve the hockey stick curve. Therefore, I have taken up additional responsibilities as COO, thereby focusing on company-wide operational excellency, which has been a challenge lately.",,"Simple, 2 pronged reasons-
1. Want to figure one/multiple use case(s) which can help our agency's operational excellence.
2. Want to keep myself up-to-date with technological advancements. Don't plan to end up like Nokias and Blackberrys of the world.",I've never coded,,,,,No,,Yes,Amateur,https://storage.tally.so/private/CV-not-handy.jpg?id=xp1exr&accessToken=eyJhbGciOiJIUzI1NiIsInR5cCI6IkpXVCJ9.eyJpZCI6InhwMWV4ciIsImZvcm1JZCI6IndkS2xXQSIsImlhdCI6MTc0MTE5MzkyOX0.3LMGRs8bvzf9jufDhiCp5aP40lo1wTZba0llQ2CKpm0&signature=9795a605e97a8c142999eb14df93d7e4a646475edb91a066b629f842bfadcff6,https://www.linkedin.com/in/letsdiscusswork/,Entrepreneur Track (I want to build products),Yes,Information already provided in the intro segment.,No-Code,,,,,,Others,"Catering all industries, providing digital solutions using AI - Agency Use case (just like Pranay) ",Excel beyond any agency globally in pitching and creating high-quality solutions for our clients with maximum efficiency possible. ,,Right now- figuring of way of optimizing everything (thanks to my new role as COO),"Working on multiple custom dashboards to keep a track of company-wide projects, unlike any other SaaS tool available in the market. Already working on the MVP code using Cursor and Grok3.",,Same as above.,,https://docs.google.com/spreadsheets/d/13lqCIVATEizZPyKNi0X11ej8LCt9kayBgIFE9vbwuv8/edit?usp=sharing,https://storage.tally.so/private/Naman---The-Ikigai-Template-_-Recalibrate-How-You-Spend-Your-Time.pdf?id=xpLXYk&accessToken=eyJhbGciOiJIUzI1NiIsInR5cCI6IkpXVCJ9.eyJpZCI6InhwTFhZayIsImZvcm1JZCI6IndkS2xXQSIsImlhdCI6MTc0MTE5MzkyOX0.wdV7-UbadaoBNbvnWLPNcS-o_Li57QCcO23xIaiSpHw&signature=e970f87ba0e58371dce7618c59043b581231085c17183ef12afcb7f061b8a34c
80rzNo,RgL8gQ,2025-03-05 17:09:52,Varnika Chabria,itismevarnica@gmail.com,2002-05-29,Yes,"134 Pierce street, West Lafayette, Indiana 47906",47906,https://storage.tally.so/private/Screenshot-2025-01-31-at-16.56.45.png?id=XDD1rj&accessToken=eyJhbGciOiJIUzI1NiIsInR5cCI6IkpXVCJ9.eyJpZCI6IlhERDFyaiIsImZvcm1JZCI6IndkS2xXQSIsImlhdCI6MTc0MTE5NDU5NH0.f41WsjgBrj2A6jRtIQpmXWu6S2a1uiYQXxCBlWJVMgA&signature=1666c85c337285f87a45b2834aa8072d6cffc7e5b0352d4f02504dcec104e6d2,Yes,No,bs in cs and ai,,,,,,building a few products/ services ,I'm familiar with coding,,I'm well versed in Python,,3-8,No,,No,,https://storage.tally.so/private/Varnika_Chabria_Resume_SDE.pdf?id=vAbVa8&accessToken=eyJhbGciOiJIUzI1NiIsInR5cCI6IkpXVCJ9.eyJpZCI6InZBYlZhOCIsImZvcm1JZCI6IndkS2xXQSIsImlhdCI6MTc0MTE5NDU5NH0.QAqmQpspkl5cXI_MWvaAdM5z__ClGBE7dXx34szLj2E&signature=7d056245a127f8f56276e2f1b12d0d0119eca2293d828e540515c046b38ba0ec,https://www.linkedin.com/in/varnikachabria/,Entrepreneur Track (I want to build products),No,,Code,,,,,,Others,New Media ,Gen Ai New media consulting + services. ,,Lowkey just having fun as of now. , I just play around with random tools. ,,"Built an ai agent which is a reel curator that scrapes the web and makes reels w an ai agent. been playing with ai tools. I havent deployed anything yet, and my biggest challenge with any project i make is to launch it and put it out there.",,https://docs.google.com/spreadsheets/d/1dwcO8xFYADb58EvW36kyzEAGWxK4MsNiFZCunzDdQAI/edit?usp=sharing.         Need an intro call to make these decisions! I will be fluking it. ,https://storage.tally.so/private/varnika-ikigai.pptx?id=2egEbj&accessToken=eyJhbGciOiJIUzI1NiIsInR5cCI6IkpXVCJ9.eyJpZCI6IjJlZ0ViaiIsImZvcm1JZCI6IndkS2xXQSIsImlhdCI6MTc0MTE5NDU5NH0.SreRcZOQp64NKVm2Gdj3eheZgcbzOnMJIkdjoVQ39ns&signature=e0ae723ed7fd355d1847c808eae79bcb2299c2befad502c56b8d103f5d445d1c
vQzrD4,WdgxrN,2025-03-05 17:10:37,Shankar,shankarsachin2u@gmail.com,1990-12-11,No,"6/98, Kizhakuthottam, Kanoorpatty (post), Namakkal",637014,https://storage.tally.so/private/1727425537769.jpeg?id=e6x4kl&accessToken=eyJhbGciOiJIUzI1NiIsInR5cCI6IkpXVCJ9.eyJpZCI6ImU2eDRrbCIsImZvcm1JZCI6IndkS2xXQSIsImlhdCI6MTc0MTE5NDYzOH0.eMAq2LeQvj0Rw-YiaQjeZPeU_eKuaGjJvNU1W749Fms&signature=a7d4eb3ca80b7d73ed2289b4827732faaf284b8556d30d7bd34160d0a7af47d2,No,,,"Modus Create, LLC",Senior Front End Engineer,8-10,"Started working customer support and transformed to a product support for a mainframe product company, grabbed an internal opportunity to develop a feature in Java which transformed my career to the programming. Now I have 8+ years of experience in full stack development.",,Learn as much as possible in the GenAI tech and transform my career towards it.,I'm familiar with coding,Yes,I've never used Python,"javascript, typescript",8-10,No,,No,,https://storage.tally.so/private/Shankar-Ganesan.pdf?id=Adb1K0&accessToken=eyJhbGciOiJIUzI1NiIsInR5cCI6IkpXVCJ9.eyJpZCI6IkFkYjFLMCIsImZvcm1JZCI6IndkS2xXQSIsImlhdCI6MTc0MTE5NDYzOH0.xJjugsbktk7cguQD3cV0V_qkzDTEGbSaQU2J24n-3Uw&signature=7c54265eb318400679450d1a3dd9057f30bd9cf8fac8922db8f783da10142c9f,https://www.linkedin.com/in/shankar-ganesan-profile/,Employment Track (Get a job / Up-skill in my career,,,Code,,Media and Entertainment,,Software Development,,Customer Support Automation,,I think customer support is something Gen AI can provide more value than humans atleast at this point of Gen AI getting started,"watching movies, solving a bug, playing a sport",,,,,https://docs.google.com/spreadsheets/d/1DNKjNi-o4d_OM1c6dFVRfKpPbH6HcHODXxcbQs6pTMs/edit?usp=sharing,,https://storage.tally.so/private/Shankar_Ganesan_Ikigai-Template-_-Recalibrate-How-You-Spend-Your-Time.pdf?id=vAvGWA&accessToken=eyJhbGciOiJIUzI1NiIsInR5cCI6IkpXVCJ9.eyJpZCI6InZBdkdXQSIsImZvcm1JZCI6IndkS2xXQSIsImlhdCI6MTc0MTE5NDYzOH0.UhbHG7QJouWYEqiFXEiA_06dbITayqqmK8_BRX_PVF0&signature=5f8bf401d772fea81669c6481a6ed6b060d854ce72e8a8d51ac74b8873a209c2
q2zDl5,bGD0lL,2025-03-05 17:23:25,Garima Singh,garima1909k@gmail.com,1996-12-09,No,"Flat no. 2, Surya Apt. Nando House, Ignou Road, Saket, New Delhi ",110068,https://storage.tally.so/private/WhatsApp-Image-2025-03-05-at-9.27.35-PM-1-.jpeg?id=48yWaA&accessToken=eyJhbGciOiJIUzI1NiIsInR5cCI6IkpXVCJ9.eyJpZCI6IjQ4eVdhQSIsImZvcm1JZCI6IndkS2xXQSIsImlhdCI6MTc0MTE5NTQwN30.lD6ImS7AkYQeWLPK9I4cMRLH2L4IAd5e-qWbi6qq4nU&signature=0f61b9458437c0c9de78e643db8626df0f1980514b0e1f8211d91aab25161480,No,,,ScaleX,Creative Designer,3-8,"I started with illustration design, where I explored creativity through detailed visuals and storytelling. Over time, my passion for design expanded, leading me into the world of graphic design after graduation. Since then, I've been bringing ideas to life as a graphic designer",,Good grasp on AI and its understanding with detailed conceptualization and more.,I've never coded,,,,,Yes,Amateur,No,,https://storage.tally.so/private/Resume-23.pdf?id=2eyqlM&accessToken=eyJhbGciOiJIUzI1NiIsInR5cCI6IkpXVCJ9.eyJpZCI6IjJleXFsTSIsImZvcm1JZCI6IndkS2xXQSIsImlhdCI6MTc0MTE5NTQwN30.XVBtQCJc2pbh_7WX9kRxQiPoomXPXUHoZMjOq_8Q7Iw&signature=cfbec4d99734b9fcd11b68802479306392f57021b8fed8b288e899fb3ac622f1,https://www.linkedin.com/in/garima-singh9/,Employment Track (Get a job / Up-skill in my career,,,No-Code,,Marketing and Advertising,,Marketing,,B2B SaaS Solutions,,A product based industry where i can use creativity and business for impactful growth and explore more.,"Painting,
Music
Playing Badminton
sometimes Styling.
",,,,,https://docs.google.com/spreadsheets/d/139Cox-EHRJb06DMWa81VEk7tevgsVA74DrGnqKq7lwE/edit?usp=sharing,,https://storage.tally.so/private/Copy-of-The-Ikigai-Template-_-Recalibrate-How-You-Spend-Your-Time-1-.pdf?id=LbqZAv&accessToken=eyJhbGciOiJIUzI1NiIsInR5cCI6IkpXVCJ9.eyJpZCI6IkxicVpBdiIsImZvcm1JZCI6IndkS2xXQSIsImlhdCI6MTc0MTE5NTQwN30.cMC1ItQHsuf195vq4f9uFko8NdA0Lwvbwl4pnLCS7UU&signature=9f0732ddcf10371ca935da6d0a28d4bc47770409bb6a73230481500d82d1a2e0
80rLLx,aoy8Ay,2025-03-05 17:25:46,Amit Pandey,amit.pandey2194@gmail.com,1994-03-21,No,"But, currently I am in India for next 3 months
Address:
B-20/201 Devendra Shantinagar CHS, Shantinagar, Sector-7, Miraroad East, Thane 401107",401107,https://storage.tally.so/private/IMG_4987.HEIC.heif?id=ZNNqAy&accessToken=eyJhbGciOiJIUzI1NiIsInR5cCI6IkpXVCJ9.eyJpZCI6IlpOTnFBeSIsImZvcm1JZCI6IndkS2xXQSIsImlhdCI6MTc0MTE5NTU0OH0.DZaJUYURG-YcQZsIbgYpYjY-S04tqEKzmqkWJSbnOfc&signature=372f442fca9b4998372736591d854bb6f0145c0207d9e48b2d0b61b1bac5f857,No,,,"Thales DIS, USA",Computer Vision Research Scientist,3-8,"I have my masters in Electrical Engineering from USC, Los Angeles. With a specialization in computer vision and deep learning.
As soon as I graduated in 2018 I joined Thales USA and was among the first scientists who helped the research center kickstart their journey to use Deep Learning to solve the challenges with Latent Fingerprints and fingerprints in general. 
My research center is focused more on Biometrics. I worked on two main projects start to end i.e. ideation, research, testing, and integration which I am happy to share is now part of the improved product offering. They also helped me secure two USA patents. The tech is also helping the company secure top rankings in NIST evaluations.

What excites me about image processing, computer vision, and deep learning is that the results are very visual.  I am a visual and intuition-seeking person. 

I have worked for seven months in France, helping the research team there with KT, collaboration efforts, and research projects.

",,"I am expecting to have a strong sense signal vs noise in the world of AI. It is moving at a brisk pace and very hard to focus and not get distracted.

I have never been entrepreneurial, I am hoping going through the entrepreneurial track will help me kickstart that journey with practical projects, solving real world challenges and strong understanding of the present and future of this tech space.

I am very open to feedback and collaboration and would love regular sync ups and check-in with mentors and trainers.

I am expecting to come out with a strong connections and future collaborators,",I'm familiar with coding,Yes,I'm well versed in Python,,3-8,No,,No,,https://storage.tally.so/private/UpdatedResume.pdf?id=V00klJ&accessToken=eyJhbGciOiJIUzI1NiIsInR5cCI6IkpXVCJ9.eyJpZCI6IlYwMGtsSiIsImZvcm1JZCI6IndkS2xXQSIsImlhdCI6MTc0MTE5NTU0OH0.mO-6ijt3V-w8QZs3tjYKH1csBeS6BKDcrUKwyhfMIO0&signature=dfae55b6e5de224fd1d42820bd9a69ca1cbff49d50692d2f1c3fb6f01f06f756,https://www.linkedin.com/in/amitpandey2194/,Entrepreneur Track (I want to build products),No,,Code,,,,,,Educational Content Generation,,"I read a book What schools should be and really got inspired to think that there are so many things that kids today are not taught or whatever is taught is not taught efficiently. So, if I can have strong grip on the AI tools, I would love to work with an education expert to come up with a solution that can provide lost cost education to underprivileged kids.

That's 1, another thing that excites me is public speaking and I want to use the AI to help people become better public speakers.",,"Both the areas, what I am passionate about is coming up with ideas, products related to educating people better. 
When it comes to education, I strongly feel, teaching people how to think and apply their knowledge is really important, but especially for the underprivileged kids, how to help them get better at their studies and real-world executions.

I strongly feel that public speaking is one of the key skills someone can work on and I am passionate about helping people on that","I am primarily working on biometrics data, working on fingerprints, and training models to solve different issues like fingerprint elasticity, latent fingerprints, tenprints.

I have worked different CVML projects like, creating snapchat like filters, youtube video recommendation based on expression. ",,"The most time that I have spent was on training deep learning model on latent fingerprints to detect minutiae. I got a patent approved on it recently. 
What was challenging about it was I had just graduated and was given enough time and resources to solve the problem. Latent fingerprints are notorious for bad quality fingerprints, and my work on it helped improve our accuracy on it and currently it is already being used in production.
I got a chance to work on it from end to end up to the point of software integration.",,https://docs.google.com/spreadsheets/d/1awRVe3AqfhghzHC2z1YIROT1OrxQGFY0ttHe87bW1Mk/edit?usp=sharing,https://storage.tally.so/private/The-Ikigai-Template-_-Recalibrate-How-You-Spend-Your-Time.pptx?id=y6pP5d&accessToken=eyJhbGciOiJIUzI1NiIsInR5cCI6IkpXVCJ9.eyJpZCI6Ink2cFA1ZCIsImZvcm1JZCI6IndkS2xXQSIsImlhdCI6MTc0MTE5NTU0OH0.oY5izkSjsPAQ5hliVJU5V1NvI8PK0N7uME2m1ayTqOw&signature=8db744f5ae81e9b6624bc92f2a2d266aa6ad829fcdef8ebfba767fd5f6992465
